{
  "$schema": "https://json-schema.org/draft/2020-12/schema",
  "$id": "https://redline-msp-automation.example/schemas/proposal.schema.json",
  "$comment": "Generated by tools/gen_schemas.py from core.queue.store.Proposal. Do not edit by hand; run the script.",
  "$defs": {
    "ApproverAuth": {
      "additionalProperties": false,
      "properties": {
        "method": {
          "enum": [
            "entra-id-token",
            "demo-picker"
          ],
          "title": "Method",
          "type": "string"
        },
        "identity": {
          "pattern": "^[a-z0-9][a-z0-9-]{0,62}$",
          "title": "Identity",
          "type": "string"
        },
        "oid": {
          "anyOf": [
            {
              "pattern": "^[0-9a-f]{8}-[0-9a-f]{4}-[0-9a-f]{4}-[0-9a-f]{4}-[0-9a-f]{12}$",
              "type": "string"
            },
            {
              "type": "null"
            }
          ],
          "default": null,
          "title": "Oid"
        },
        "tid": {
          "anyOf": [
            {
              "pattern": "^[0-9a-f]{8}-[0-9a-f]{4}-[0-9a-f]{4}-[0-9a-f]{4}-[0-9a-f]{12}$",
              "type": "string"
            },
            {
              "type": "null"
            }
          ],
          "default": null,
          "title": "Tid"
        },
        "amr": {
          "default": [],
          "items": {
            "pattern": "^[a-z0-9]{1,32}$",
            "type": "string"
          },
          "title": "Amr",
          "type": "array"
        },
        "sid": {
          "anyOf": [
            {
              "pattern": "^[A-Za-z0-9-]{1,64}$",
              "type": "string"
            },
            {
              "type": "null"
            }
          ],
          "default": null,
          "title": "Sid"
        },
        "issued_at": {
          "anyOf": [
            {
              "pattern": "^\\d{4}-\\d{2}-\\d{2}T\\d{2}:\\d{2}:\\d{2}Z$",
              "type": "string"
            },
            {
              "type": "null"
            }
          ],
          "default": null,
          "title": "Issued At"
        },
        "expires_at": {
          "anyOf": [
            {
              "pattern": "^\\d{4}-\\d{2}-\\d{2}T\\d{2}:\\d{2}:\\d{2}Z$",
              "type": "string"
            },
            {
              "type": "null"
            }
          ],
          "default": null,
          "title": "Expires At"
        },
        "note": {
          "default": "",
          "title": "Note",
          "type": "string"
        }
      },
      "required": [
        "method",
        "identity"
      ],
      "title": "ApproverAuth",
      "type": "object"
    },
    "Verification": {
      "additionalProperties": false,
      "description": "How the requester was verified out of band before an approval (C-30, governance HO-4).",
      "properties": {
        "method": {
          "enum": [
            "callback-on-file",
            "in-person",
            "manager-confirmed",
            "finding-reference"
          ],
          "title": "Method",
          "type": "string"
        },
        "by": {
          "maxLength": 64,
          "minLength": 1,
          "title": "By",
          "type": "string"
        },
        "at": {
          "format": "date-time",
          "title": "At",
          "type": "string"
        },
        "ref": {
          "default": "",
          "maxLength": 64,
          "pattern": "^[A-Za-z0-9._:#/-]*$",
          "title": "Ref",
          "type": "string"
        }
      },
      "required": [
        "method",
        "by",
        "at"
      ],
      "title": "Verification",
      "type": "object"
    }
  },
  "additionalProperties": false,
  "description": "A pending write-lever proposal (the shared Slice A/B/C contract).",
  "properties": {
    "id": {
      "title": "Id",
      "type": "string"
    },
    "source": {
      "enum": [
        "triage",
        "baseline",
        "rollback"
      ],
      "title": "Source",
      "type": "string"
    },
    "ref": {
      "maxLength": 64,
      "minLength": 1,
      "pattern": "^[^\\r\\n]*$",
      "title": "Ref",
      "type": "string"
    },
    "lever": {
      "maxLength": 64,
      "pattern": "^[a-z][a-z0-9]*(\\.[a-z][a-z0-9-]*)+$",
      "title": "Lever",
      "type": "string"
    },
    "client": {
      "pattern": "^[a-z0-9][a-z0-9-]{0,62}$",
      "title": "Client",
      "type": "string"
    },
    "params": {
      "additionalProperties": {
        "anyOf": [
          {
            "type": "string"
          },
          {
            "type": "integer"
          },
          {
            "type": "boolean"
          }
        ]
      },
      "title": "Params",
      "type": "object"
    },
    "requested_by": {
      "pattern": "^[a-z0-9][a-z0-9-]{0,62}$",
      "title": "Requested By",
      "type": "string"
    },
    "reason": {
      "maxLength": 200,
      "minLength": 1,
      "pattern": "^[^\\r\\n]*$",
      "title": "Reason",
      "type": "string"
    },
    "created": {
      "title": "Created",
      "type": "string"
    },
    "status": {
      "default": "pending",
      "enum": [
        "pending",
        "approved",
        "rejected",
        "executed",
        "failed"
      ],
      "title": "Status",
      "type": "string"
    },
    "decided_by": {
      "anyOf": [
        {
          "pattern": "^[a-z0-9][a-z0-9-]{0,62}$",
          "type": "string"
        },
        {
          "type": "null"
        }
      ],
      "default": null,
      "title": "Decided By"
    },
    "decided_at": {
      "anyOf": [
        {
          "type": "string"
        },
        {
          "type": "null"
        }
      ],
      "default": null,
      "title": "Decided At"
    },
    "verification": {
      "anyOf": [
        {
          "$ref": "#/$defs/Verification"
        },
        {
          "type": "null"
        }
      ],
      "default": null
    },
    "approver_auth": {
      "anyOf": [
        {
          "$ref": "#/$defs/ApproverAuth"
        },
        {
          "type": "null"
        }
      ],
      "default": null
    }
  },
  "required": [
    "id",
    "source",
    "ref",
    "lever",
    "client",
    "params",
    "requested_by",
    "reason",
    "created"
  ],
  "title": "Proposal",
  "type": "object"
}
